"faq_id","question_variant"
"FAQ_001","Как создать аккаунт в сервисе?"
"FAQ_001","Как пройти регистрацию в сервисе?"
"FAQ_001","Где можно зарегистрироваться в сервисе?"
"FAQ_001","Подскажите, как зарегистрироваться в сервисе?"
"FAQ_001","Не могу зарегистрироваться в сервисе ,что делать?"
"FAQ_001","Как зарегистрироваться в сервисе?"
"FAQ_002","Как авторизоваться в личный кабинет?"
"FAQ_002","Как зайти в личный кабинет?"
"FAQ_002","Где можно войти в личный кабинет?"
"FAQ_002","Подскажите, как войти в личный кабинет?"
"FAQ_002","Не могу войти в личный кабинет, что делать?"
"FAQ_002","Как войти в личный кабинет?"
"FAQ_003","Забыл пароль, что делать?"
"FAQ_003","Что делать, если я забыл пароль?"
"FAQ_003","Как восстановить доступ, если я забыл пароль?"
"FAQ_003","Не получается: я забыл пароль. Что делать?"
"FAQ_003","Нужна помощь: я забыл пароль"
"FAQ_003","Забыл пароль, как восстановить?"
"FAQ_004","Как поменять пароль?"
"FAQ_004","Как изменить пароль?"
"FAQ_004","Где можно сменить пароль?"
"FAQ_004","Подскажите, как сменить пароль?"
"FAQ_004","Не могу сменить пароль, что делать?"
"FAQ_004","Как сменить пароль в сервисе?"
"FAQ_005","Как поменять email в профиле?"
"FAQ_005","Как обновить email в профиле?"
"FAQ_005","Где можно изменить email в профиле?"
"FAQ_005","Подскажите, как изменить email в профиле?"
"FAQ_005","Не могу изменить email в профиле, что делать?"
"FAQ_005","Как изменить email в профиле в сервисе?"
"FAQ_006","Из-за чего не приходит письмо с подтверждением?"
"FAQ_006","По какой причине не приходит письмо с подтверждением?"
"FAQ_006","Не приходит письмо с подтверждением, почему?"
"FAQ_006","Почему не приходит письмо с подтверждением в сервисе?"
"FAQ_006","Письмо с подтверждением не работает, почему?"
"FAQ_006","Почему не приходит письмо с подтверждением?"
"FAQ_007","Какие предусмотренные тарифы доступны?"
"FAQ_007","Какие тарифы доступны?"
"FAQ_007","Можно ли получить доступные?"
"FAQ_007","Есть ли возможность получить доступные тарифы?"
"FAQ_007","У вас есть тарифы, которые доступны?"
"FAQ_007","Где посмотреть доступные тарифы?"
"FAQ_008","Как поменять тарифный план?"
"FAQ_008","Как изменить тарифный план?"
"FAQ_008","Где можно сменить тарифный план?"
"FAQ_008","Подскажите, как сменить тарифный план?"
"FAQ_008","Не могу сменить тарифный план, что делать?"
"FAQ_008","Как сменить тарифный план в сервисе?"
"FAQ_009","Возможно ли отменить подписку?"
"FAQ_009","Есть ли возможность отменить подписку?"
"FAQ_009","Разрешено ли отменить подписку?"
"FAQ_009","Можно ли отменить подписку в сервисе?"
"FAQ_009","Можно ли отменить подписку?"
"FAQ_009","Как отменить подписку?"
"FAQ_010","Как проходит оплата сервиса?"
"FAQ_010","Где можно происходит оплата сервиса?"
"FAQ_010","Подскажите, как происходит оплата сервиса?"
"FAQ_010","Не могу происходит оплата сервиса, что делать?"
"FAQ_010","Как происходит оплата сервиса в сервисе?"
"FAQ_010","Как происходит оплата сервиса?"
"FAQ_011","Предоставляете ли закрывающие документы?"
"FAQ_011","Можно ли получить закрывающие документы?"
"FAQ_011","Где скачать закрывающие документы?"
"FAQ_011","Как получить закрывающие документы?"
"FAQ_011","Закрывающие документы доступны?"
"FAQ_011","Есть ли закрывающие документы?"
"FAQ_012","платеж не прошел, что делать?"
"FAQ_012","Что делать, если платеж не прошел?"
"FAQ_012","Как восстановить доступ, если платеж не прошел?"
"FAQ_012","Не получается: платеж не прошел. Что делать?"
"FAQ_012","Нужна помощь: платеж не прошел"
"FAQ_012","Платеж не прошел, как восстановить?"
"FAQ_013","Предусмотрен ли бесплатный пробный период?"
"FAQ_013","Доступен ли бесплатный пробный период?"
"FAQ_013","Можно ли получить бесплатный пробный период?"
"FAQ_013","Есть ли возможность бесплатный пробный период?"
"FAQ_013","У вас есть бесплатный пробный период?"
"FAQ_013","Бесплатный пробный период доступен?"
"FAQ_014","Как закрыть аккаунт?"
"FAQ_014","Как деактивировать аккаунт?"
"FAQ_014","Где можно удалить аккаунт?"
"FAQ_014","Подскажите, как удалить аккаунт?"
"FAQ_014","Не могу удалить аккаунт, что делать?"
"FAQ_014","Как удалить аккаунт в сервисе?"
"FAQ_015","Возможно ли восстановить удаленный аккаунт?"
"FAQ_015","Есть ли возможность восстановить удаленный аккаунт?"
"FAQ_015","Разрешено ли восстановить удаленный аккаунт?"
"FAQ_015","Можно ли восстановить удаленный аккаунт в сервисе?"
"FAQ_015","Можно ли восстановить удаленный аккаунт?"
"FAQ_015","Как восстановить удаленный аккаунт?"
"FAQ_016","Из-за чего сервис работает медленно?"
"FAQ_016","По какой причине сервис работает медленно?"
"FAQ_016","Сервис работает медленно, почему?"
"FAQ_016","Почему сервис работает медленно в сервисе?"
"FAQ_016","Сервис работает медленно не работает, почему?"
"FAQ_016","Почему сервис работает медленно?"
"FAQ_017","Сервис недоступен, что делать?"
"FAQ_017","Не открывается сервис, что делать?"
"FAQ_017","Сервис не работает, что делать?"
"FAQ_017","Не могу зайти: сервис недоступен"
"FAQ_017","Пишет, что сервис недоступен, как решить?"
"FAQ_017","Проблема: сервис недоступен"
"FAQ_018","Как корректно работает на мобильных устройствах?"
"FAQ_018","Где можно поддерживается ли мобильная версия?"
"FAQ_018","Подскажите, как поддерживается ли мобильная версия?"
"FAQ_018","Не могу поддерживается ли мобильная версия, что делать?"
"FAQ_018","Поддерживается ли мобильная версия в сервисе?"
"FAQ_018","Поддерживается ли мобильная версия?"
"FAQ_019","Есть ли мобильное приложение?"
"FAQ_019","Где указана информация о мобильном приложении?"
"FAQ_019","Как узнать, есть ли мобильное приложение?"
"FAQ_019","Не могу найти мобильное приложение, что делать?"
"FAQ_019","Есть ли мобильное приложение сервиса?"
"FAQ_019","Есть ли мобильное приложение?"
"FAQ_020","Как написать в чат поддержки?"
"FAQ_020","Как связаться с поддержкой?"
"FAQ_020","Где можно связаться с технической поддержкой?"
"FAQ_020","Подскажите, как связаться с технической поддержкой?"
"FAQ_020","Не могу связаться с технической поддержкой, что делать?"
"FAQ_020","Как связаться с технической поддержкой в сервисе?"
"FAQ_021","Как поменять имя и данные профиля?"
"FAQ_021","Как обновить имя и данные профиля?"
"FAQ_021","Где можно изменить имя и данные профиля?"
"FAQ_021","Подскажите, как изменить имя и данные профиля?"
"FAQ_021","Не могу изменить имя и данные профиля, что делать?"
"FAQ_021","Как изменить имя и данные профиля в сервисе?"
"FAQ_022","Как поменять язык интерфейса?"
"FAQ_022","Как обновить язык интерфейса?"
"FAQ_022","Где можно изменить язык интерфейса?"
"FAQ_022","Подскажите, как изменить язык интерфейса?"
"FAQ_022","Не могу изменить язык интерфейса, что делать?"
"FAQ_022","Как изменить язык интерфейса в сервисе?"
"FAQ_023","Как поменять часовой пояс?"
"FAQ_023","Как обновить часовой пояс?"
"FAQ_023","Где можно изменить часовой пояс?"
"FAQ_023","Подскажите, как изменить часовой пояс?"
"FAQ_023","Не могу изменить часовой пояс, что делать?"
"FAQ_023","Как изменить часовой пояс в сервисе?"
"FAQ_024","Как подключить двухфакторную аутентификацию?"
"FAQ_024","Как активировать двухфакторную аутентификацию?"
"FAQ_024","Где можно включить двухфакторную аутентификацию?"
"FAQ_024","Подскажите, как включить двухфакторную аутентификацию?"
"FAQ_024","Не могу включить двухфакторную аутентификацию, что делать?"
"FAQ_024","Как включить двухфакторную аутентификацию в сервисе?"
"FAQ_025","Как выключить двухфакторную аутентификацию?"
"FAQ_025","Как деактивировать двухфакторную аутентификацию?"
"FAQ_025","Где можно отключить двухфакторную аутентификацию?"
"FAQ_025","Подскажите, как отключить двухфакторную аутентификацию?"
"FAQ_025","Не могу отключить двухфакторную аутентификацию, что делать?"
"FAQ_025","Как отключить двухфакторную аутентификацию в сервисе?"
"FAQ_026","Из-за чего код подтверждения не приходит?"
"FAQ_026","По какой причине код подтверждения не приходит?"
"FAQ_026","Код подтверждения не приходит, почему?"
"FAQ_026","Почему код подтверждения не приходит в сервисе?"
"FAQ_026","Код подтверждения не приходит не работает, почему?"
"FAQ_026","Почему код подтверждения не приходит?"
"FAQ_027","Как поменять способ оплаты?"
"FAQ_027","Как изменить способ оплаты?"
"FAQ_027","Где можно изменить способ оплаты?"
"FAQ_027","Подскажите, как изменить способ оплаты?"
"FAQ_027","Не могу изменить способ оплаты, что делать?"
"FAQ_027","Как изменить способ оплаты в сервисе?"
"FAQ_028","Как увидеть историю платежей?"
"FAQ_028","Как проверить историю платежей?"
"FAQ_028","Где можно посмотреть историю платежей?"
"FAQ_028","Подскажите, как посмотреть историю платежей?"
"FAQ_028","Не могу посмотреть историю платежей, что делать?"
"FAQ_028","Как посмотреть историю платежей в сервисе?"
"FAQ_029","Как загрузить счет или чек?"
"FAQ_029","Как скачать счет или чек?"
"FAQ_029","Где можно скачать счет или чек?"
"FAQ_029","Подскажите, как скачать счет или чек?"
"FAQ_029","Не могу скачать счет или чек, что делать?"
"FAQ_029","Как скачать счет или чек в сервисе?"
"FAQ_030","Как вернуть деньги за подписку?"
"FAQ_030","Где можно вернуть деньги за подписку?"
"FAQ_030","Подскажите, как вернуть деньги за подписку?"
"FAQ_030","Не могу вернуть деньги за подписку, что делать?"
"FAQ_030","Как вернуть деньги за подписку в сервисе?"
"FAQ_030","Как вернуть деньги за подписку?"
"FAQ_031","Предусмотрен ли скидки для команды или бизнеса?"
"FAQ_031","Доступен ли скидки для команды или бизнеса?"
"FAQ_031","Можно ли получить скидки для команды или бизнеса?"
"FAQ_031","Есть ли возможность скидки для команды или бизнеса?"
"FAQ_031","У вас есть скидки для команды или бизнеса?"
"FAQ_031","Скидки для команды или бизнеса доступен?"
"FAQ_032","Как пригласить пользователя в команду?"
"FAQ_032","Как добавить участника в команду?"
"FAQ_032","Где можно добавить пользователя в команду?"
"FAQ_032","Подскажите, как добавить пользователя в команду?"
"FAQ_032","Не могу добавить пользователя в команду, что делать?"
"FAQ_032","Как добавить пользователя в команду в сервисе?"
"FAQ_033","Как убрать пользователя из команды?"
"FAQ_033","Как исключить пользователя из команды?"
"FAQ_033","Где можно удалить пользователя из команды?"
"FAQ_033","Подскажите, как удалить пользователя из команды?"
"FAQ_033","Не могу удалить пользователя из команды, что делать?"
"FAQ_033","Как удалить пользователя из команды в сервисе?"
"FAQ_034","Как узнать: какие роли и права доступа есть?"
"FAQ_034","Подскажите пожалуйста: какие роли и права доступа есть?"
"FAQ_034","Где посмотреть информацию: какие роли и права доступа есть?"
"FAQ_034","Интересует: какие роли и права доступа есть"
"FAQ_034","Какие роли и права доступа есть, подскажите"
"FAQ_034","Какие роли и права доступа есть в сервисе, как это работает?"
"FAQ_035","Как поменять роль пользователя?"
"FAQ_035","Как изменить роль пользователя?"
"FAQ_035","Где можно поменять роль пользователя?"
"FAQ_035","Подскажите, как поменять роль пользователя?"
"FAQ_035","Не могу поменять роль пользователя, что делать?"
"FAQ_035","Как поменять роль пользователя в сервисе?"
"FAQ_036","Как загрузить файл в систему?"
"FAQ_036","Как загрузить документ в систему?"
"FAQ_036","Где можно загрузить файл в систему?"
"FAQ_036","Подскажите, как загрузить файл в систему?"
"FAQ_036","Не могу загрузить файл в систему, что делать?"
"FAQ_036","Как загрузить файл в систему в сервисе?"
"FAQ_037","Как узнать: какие форматы файлов поддерживаются?"
"FAQ_037","Подскажите пожалуйста: какие форматы файлов поддерживаются?"
"FAQ_037","Где посмотреть информацию: какие форматы файлов поддерживаются?"
"FAQ_037","Интересует: какие форматы файлов поддерживаются"
"FAQ_037","Какие форматы файлов поддерживаются, подскажите"
"FAQ_037","Какие форматы файлов поддерживаются в сервисе, как это работает?"
"FAQ_038","Из-за чего файл не загружается?"
"FAQ_038","По какой причине файл не загружается?"
"FAQ_038","Файл не загружается, почему?"
"FAQ_038","Почему файл не загружается в сервисе?"
"FAQ_038","Файл не загружается не работает, почему?"
"FAQ_038","Почему файл не загружается?"
"FAQ_039","Предусмотрен ли ограничение на размер файла?"
"FAQ_039","Доступен ли ограничение на размер файла?"
"FAQ_039","Можно ли получить ограничение на размер файла?"
"FAQ_039","Есть ли возможность ограничение на размер файла?"
"FAQ_039","У вас есть ограничение на размер файла?"
"FAQ_039","Ограничение на размер файла доступен?"
"FAQ_040","Как найти нужный документ?"
"FAQ_040","Как найти нужную запись?"
"FAQ_040","Где можно найти нужный документ или запись?"
"FAQ_040","Подскажите, как найти нужный документ или запись?"
"FAQ_040","Не могу найти нужный документ или запись, что делать?"
"FAQ_040","Как найти нужный документ или запись в сервисе?"
"FAQ_041","Как выгрузить данные?"
"FAQ_041","Как скачать экспорт данных?"
"FAQ_041","Где можно экспортировать данные?"
"FAQ_041","Подскажите, как экспортировать данные?"
"FAQ_041","Не могу экспортировать данные, что делать?"
"FAQ_041","Как экспортировать данные в сервисе?"
"FAQ_042","Как загрузить данные в систему?"
"FAQ_042","Как импортировать данные?"
"FAQ_042","Где можно импортировать данные?"
"FAQ_042","Подскажите, как импортировать данные?"
"FAQ_042","Не могу импортировать данные, что делать?"
"FAQ_042","Как импортировать данные в сервисе?"
"FAQ_043","Как увидеть API и где документация?"
"FAQ_043","Как посмотреть API и где документация?"
"FAQ_043","Где можно API и где документация?"
"FAQ_043","Подскажите, как API и где документация?"
"FAQ_043","Не могу API и где документация, что делать?"
"FAQ_043","Как API и где документация в сервисе?"
"FAQ_044","Как получить API-ключ?"
"FAQ_044","Как создать API-ключ?"
"FAQ_044","Где можно получить API-ключ?"
"FAQ_044","Подскажите, как получить API-ключ?"
"FAQ_044","Не могу получить API-ключ, что делать?"
"FAQ_044","Как получить API-ключ в сервисе?"
"FAQ_045","Как отозвать API-ключ?"
"FAQ_045","Как удалить API-ключ?"
"FAQ_045","Где можно отозвать API-ключ?"
"FAQ_045","Подскажите, как отозвать API-ключ?"
"FAQ_045","Не могу отозвать API-ключ, что делать?"
"FAQ_045","Как отозвать API-ключ в сервисе?"
"FAQ_046","Что значит ошибка 500?"
"FAQ_046","Появляется ошибка 500, что делать?"
"FAQ_046","Ошибка 500: в чем причина?"
"FAQ_046","Как исправить ошибку 500?"
"FAQ_046","Почему возникает ошибка 500?"
"FAQ_046","Вижу ошибку 500 при работе с сервисом"
"FAQ_047","Что значит ошибка 403?"
"FAQ_047","Появляется ошибка 403, что делать?"
"FAQ_047","Ошибка 403: в чем причина?"
"FAQ_047","Как исправить ошибку 403?"
"FAQ_047","Почему возникает ошибка 403?"
"FAQ_047","Вижу ошибку 403 при работе с сервисом"
"FAQ_048","Что значит ошибка 404?"
"FAQ_048","Появляется ошибка 404, что делать?"
"FAQ_048","Ошибка 404: в чем причина?"
"FAQ_048","Как исправить ошибку 404?"
"FAQ_048","Почему возникает ошибка 404?"
"FAQ_048","Вижу ошибку 404 при работе с сервисом"
"FAQ_049","Как сообщить об ошибке или баге?"
"FAQ_049","Как отправить баг-репорт?"
"FAQ_049","Где можно сообщить об ошибке или баге?"
"FAQ_049","Подскажите, как сообщить об ошибке или баге?"
"FAQ_049","Не могу сообщить об ошибке или баге, что делать?"
"FAQ_049","Как сообщить об ошибке или баге в сервисе?"
"FAQ_050","Как узнать: где посмотреть статус сервиса?"
"FAQ_050","Подскажите пожалуйста: где посмотреть статус сервиса?"
"FAQ_050","Где посмотреть информацию: где посмотреть статус сервиса?"
"FAQ_050","Интересует: где посмотреть статус сервиса"
"FAQ_050","Где посмотреть статус сервиса, подскажите"
"FAQ_050","Где посмотреть статус сервиса в сервисе, как это работает?"
